{
  "$schema": "https://json-schema.org/draft/2020-12/schema",
  "title": "nf-combo/1 组合证书",
  "type": "object",
  "additionalProperties": false,
  "required": [
    "schema",
    "packs",
    "modules",
    "module_count",
    "layer_stacks",
    "dependency_closure",
    "event_closure",
    "legal",
    "digest"
  ],
  "properties": {
    "schema": {
      "const": "nf-combo/1"
    },
    "label": {
      "type": "string",
      "minLength": 2
    },
    "note": {
      "type": "string",
      "minLength": 4
    },
    "packs": {
      "type": "array",
      "items": {
        "type": "string",
        "minLength": 2
      }
    },
    "unknown_packs": {
      "type": "array",
      "items": {
        "type": "string"
      }
    },
    "extra_modules": {
      "type": "array",
      "items": {
        "type": "string"
      }
    },
    "modules": {
      "type": "array",
      "minItems": 1,
      "items": {
        "type": "string"
      }
    },
    "module_count": {
      "type": "integer",
      "minimum": 1
    },
    "layer_stacks": {
      "type": "array",
      "minItems": 1,
      "items": {
        "type": "object",
        "additionalProperties": false,
        "required": [
          "layer",
          "modules"
        ],
        "properties": {
          "layer": {
            "type": "string",
            "minLength": 3
          },
          "modules": {
            "type": "array",
            "minItems": 1,
            "items": {
              "type": "string",
              "minLength": 2
            }
          }
        }
      }
    },
    "dependency_closure": {
      "type": "object",
      "additionalProperties": false,
      "required": [
        "core",
        "explicit",
        "dangling"
      ],
      "properties": {
        "core": {
          "type": "array"
        },
        "explicit": {
          "type": "array"
        },
        "dangling": {
          "type": "array",
          "maxItems": 0
        }
      }
    },
    "event_closure": {
      "type": "object",
      "additionalProperties": false,
      "required": [
        "published",
        "unbridged"
      ],
      "properties": {
        "published": {
          "type": "array"
        },
        "unbridged": {
          "type": "array",
          "maxItems": 0
        }
      }
    },
    "events_unpublished": {
      "type": "array",
      "maxItems": 0
    },
    "assets_borrowed": {
      "type": "array"
    },
    "modules_borrowed": {
      "type": "array"
    },
    "references_unresolved": {
      "type": "array",
      "maxItems": 0
    },
    "assets_unresolved": {
      "type": "array",
      "maxItems": 0
    },
    "module_missing_contract": {
      "type": "array",
      "maxItems": 0
    },
    "legal": {
      "const": true
    },
    "digest": {
      "type": "string",
      "pattern": "^[0-9a-f]{32}$"
    }
  }
}
