{
  "assets_borrowed": [],
  "assets_unresolved": [],
  "dependency_closure": {
    "core": [
      "M00",
      "M06",
      "M08",
      "M10",
      "M12",
      "M13",
      "M20",
      "M22",
      "M23",
      "M24",
      "M50",
      "M80",
      "M90",
      "事件:M22",
      "通用:M10"
    ],
    "dangling": [],
    "explicit": [
      "AI法律与合规:M01",
      "AI金融投研与风控:M01",
      "可解释性与审计:M01",
      "隐私与数据治理:M01"
    ]
  },
  "digest": "1120685bc682a148f62c3a317596be2b",
  "event_closure": {
    "published": [
      "d03_report_conflict",
      "d03_report_ready",
      "d03_spec_conflict",
      "d03_spec_ready",
      "d04_report_conflict",
      "d04_report_ready",
      "d04_spec_conflict",
      "d04_spec_ready",
      "doc_delta_committed",
      "doc_structure_ready",
      "f03_report_conflict",
      "f03_report_ready",
      "f03_spec_conflict",
      "f03_spec_ready",
      "f06_report_conflict",
      "f06_report_ready",
      "f06_spec_conflict",
      "f06_spec_ready",
      "intent_received",
      "interaction_update",
      "minute_tick",
      "narrative_event",
      "quest_state",
      "tick_day",
      "weather_state"
    ],
    "unbridged": []
  },
  "events_unpublished": [],
  "extra_modules": [],
  "label": "组合包 组合包-受监管行业",
  "layer_stacks": [
    {
      "layer": "P40",
      "modules": [
        "AI法律与合规:M01",
        "AI金融投研与风控:M01",
        "可解释性与审计:M01",
        "隐私与数据治理:M01"
      ]
    },
    {
      "layer": "P60",
      "modules": [
        "AI法律与合规:M02",
        "AI金融投研与风控:M02",
        "可解释性与审计:M02",
        "隐私与数据治理:M02"
      ]
    }
  ],
  "legal": true,
  "module_count": 8,
  "module_missing_contract": [],
  "modules": [
    "AI法律与合规:M01",
    "AI法律与合规:M02",
    "AI金融投研与风控:M01",
    "AI金融投研与风控:M02",
    "可解释性与审计:M01",
    "可解释性与审计:M02",
    "隐私与数据治理:M01",
    "隐私与数据治理:M02"
  ],
  "modules_borrowed": [],
  "note": "由 nf combine materialize 产物化；组合合法性由五不变量给出",
  "packs": [
    "AI法律与合规域包",
    "AI金融投研与风控域包",
    "可解释性与审计域包",
    "隐私与数据治理域包"
  ],
  "references_unresolved": [],
  "schema": "nf-combo/1",
  "unknown_packs": []
}
